{"$schema":"https://json-schema.org/draft/2020-12/schema","$id":"auditable-ai-assurance-case.schema.json","title":"Auditable AI Assurance Case","type":"object","required":["case_id","safety_claim","control","implementation","test","evidence","human_review","bounded_decision"],"properties":{"case_id":{"type":"string"},"safety_claim":{"type":"object"},"control":{"type":"object"},"implementation":{"type":"object"},"test":{"type":"object"},"evidence":{"type":"array"},"human_review":{"type":"object"},"bounded_decision":{"type":"object"},"unresolved_critical_bypass":{"type":"boolean"},"decision_pack_manifest_sha256":{"type":"string"}}}
