{"case_id":"AAI-ADVERSARIAL-001","safety_claim":{"id":"SC-1"},"control":{"id":"C-1","claim_id":"SC-WRONG","policy_model":"model-a"},"implementation":{"id":"I-1","control_id":"C-WRONG"},"test":{"id":"T-1","implementation_id":"I-WRONG","policy_model":"model-a","prohibited_use_passed":true,"critical_false_negatives":0},"evidence":[{"type":"ARTIFACT_ID","reference":"duplicate"},{"type":"ARTIFACT_ID","reference":"duplicate"},"not-an-object"],"human_review":{"reviewer":"Reviewer","approved":true},"bounded_decision":{"state":"PRODUCTION_AUTHORIZED"},"unresolved_critical_bypass":false}
