{"case_id":"AAI-SYNTH-001","safety_claim":{"id":"SC-1","statement":"Synthetic classifier use remains bounded by prohibited-use controls."},"control":{"id":"C-1","policy_model":"synthetic-model-1"},"implementation":{"id":"I-1","control_id":"C-1"},"test":{"id":"T-1","policy_model":"synthetic-model-1","prohibited_use_passed":true,"critical_false_negatives":0},"evidence":[{"type":"ARTIFACT_ID","reference":"synthetic-test-evidence-1","sha256":"sha256:aaaaaaaaaaaaaaaaaaaaaaaaaaaaaaaaaaaaaaaaaaaaaaaaaaaaaaaaaaaaaaaa","json_pointer":"/test"}],"human_review":{"reviewer":"Accountable Reviewer","approved":true},"bounded_decision":{"state":"CONTROLLED_TEST_READY"},"unresolved_critical_bypass":false}
